index,review,cpu,graphicard,hardisk,ram,screen
0,Worked great until the bottom half of the screen went fuzzy and started blinking. We only bought it 3 months ago. We've only used it at home on the couch. Its never been dropped or taken anywhere.,2,4,5,4,5
1,Quick to start but slow on some more processor intense operations. Excellent value for the money I paid for it.,2,2,5,4,2
2,"So far so good. It came as advertised gtx 1050ti. Battery life is prettt bad. No gaming and light use, I was needing a charge after 2 hours. I paid for one day shipping and Amazon botched it. Seen it coming too,and questioned them on it,but they assured me it was on schedule. They took care of it of course.",2,0,3,2,2
3,Not what I expected. Slow even with 2 windows or tabs open. Battery life is not as long as noted. Maybe a good kids first pc but other than punching buttons it is too slow and freezes all the time.,3,2,5,4,6
4,"I spent a good amount of time searching for a decent laptop. I was stuck between a Mac and an ASUS, I ended up going with this laptop...obviously.I was looking for a laptop with a lot of memory, I'm becoming a coder so I needed plenty of space for my applications and programs. This laptop has it's pros and cons, just like anything else does. I'll start with pros: the look of it is very nice and sleek I must say, space, of course, is a big plus to me, I really just love ASUS as a whole honestly. Cons: the battery life isn't as spectacular as I would think it would be, the speakers are not that great, although I stream it through my tv so that doesn't really matter too much. Sometimes, it will randomly freeze, not too long but long enough.Overall I will say it's a good computer and I'm pleased with it. So depending on what you are looking for in terms of use, I would suggest this one if it would suit your needs.",1,2,1,2,3
5,So far a great laptop that more than exceeds what I need in a daily work computer. Plenty fast and reliable with no issues to date. Screen is great just wish that it would open to a larger angle. Keys and trackpad are among the best I have used in a windows laptop with perfect travel and response. Combined with the dock and an external monitor it really is a pleasure to work on.,0,2,3,2,4
6,False advertising! Comes with a dvd\rw that doesnt work because you have to buy the software to use the dvd player after you recieve it. Windows 10 does not support the dvd functions without buying the dvd app from Microsoft. I found this out by chatting with the Microsoft support tech. I'm betting all the other pc and laptops with Windows 10 are the same way. Sounds like a class action lawsuit to me.,2,2,1,2,2
7,"This item was not what I expected it was in bad shape and didn't charge the battery after I charge it for 2 hours it look very old and scratches all over, I'm very disappointed.",3,2,5,4,6
8,One of my favorite laptop's yet,2,2,4,4,2
9,"This laptop is a reasonable price but its still not worth it. I should have sent it back right from the start but thought I would hang in there with it. I am on a 400 mps wifi with a router that supports up to 600 and I am barely squeaking out 120 in the same room as the router. All other laptops (HP) have no issues reaching over 300. It is extremely slow and half the time will not process links even with pop up blocker off. Buy a better machine, I wish I did.",2,3,1,2,2
10,"Bought this as a second gaming pc for my daughter to play MMORPGs with me. Inexpensive, uncomplicated, and ready to go in an hour. Love it. No problems so far.",2,0,1,2,2
11,"The only reason I am giving it four stars and not five is because of the keyboard, which is okay but could be better. Otherwise, it is a great chromebook.",2,4,5,4,5
12,So far it is good,2,1,1,2,2
13,"Small, compact, beautiful color, quality materials for the exterior. It's just like my bigger asus. If you like asus you'll love this computer. It's got everything. At first I had a little trouble with the web browsing (maybe it was my internet) but it works great now. Great alternative if you want all the looks of a MacBook Air but not the price. Plus, it's got windows! How much better can it get. Now I can take a light and efficient (cause the battery is WOW) laptop to class with me. Great for turning in assignments and printing on the go!Update--- removed a star because it sometimes shuts off for no reason and you have to hold down the power button for legitimately 20 seconds for it to turn on again. I have mini heart attacks every time this happens.",3,1,5,4,3
14,"Good quality exept it has very horrible batterie life, mine only last about 3 hours",3,1,5,4,3
15,Awesome computer!,3,1,5,4,3
16,The laptop lasted under a month and one day it just died and didn't turn back on...,3,1,5,4,3
17,"The only reason the computer did not get 5 stars is because the picture and the description show a dark blue computer, but it is purple.",3,2,0,2,2
18,so far so good,3,1,2,4,2
19,Definitely enjoy. However the transfer of data from my other computer has been time consuming,2,2,0,2,2
20,"love this, sadly use it more than my MacBook pro.",2,4,5,4,5
21,Good modern product. Arrived in time.,3,2,2,0,3
22,"Only have it two stars, mostly for style, not even two months owning this laptop and already faced slow performance with the hard drive causing most of the slow down in performance, not to mention they use a cheap drive for this laptop, being that it's a gamer laptop you would think they would use a much better hard drive built for gaming rather than an ordinary hard drive, anyways was very disappointed with this laptop even with all the tweaks that I used to supposedly stop the 100% disk usage issue, did not fix the problem as the performance issue came back a couple days later, in the end I just returned it for a refund and will just order next time with the components I want in a gaming laptop, at least I'll get what I pay for next time",1,0,1,2,2
23,DOWNGRADED to 2 stars because of the supplied Operating System. Don't buy unless you're willing to format. The Win 10-Home that comes with it is USELESS. I'm losing many hours of work because the unmanageable updates are constantly breaking my programs. The audio pops all the time and the video on my HDMI began to spaz out after one of these unrequested updates.UPDATE: upgraded to Win 10 per ASUS support suggestion and it has solved NOTHING !! It's fast but all the quirks will drive you crazy. Go find a Toshiba or Lenovo.UPDATE: ASUS support completely clueless. Tells me to format. They have no real 2nd tier knowledge to solve problems. They just e-mail people telling them to format.,1,2,1,2,3
24,"More than what I expected. My last Dell didnt last long but I did get it at Walmart. This computer is beatiful, easy to work through, even with the new Windows, and it has handled every program and game I have played on it. Worth the money.",1,0,1,2,2
25,"I love this laptop, functions great, great price. Thank you HP for such a high quality laptop",2,2,1,1,1
26,"Perhaps it's because I'm middle aged and slowing down myself but I don't understand how anyone can think this is a slow computer. It's not the fastest I've owned but an i3 priced in the $350 range isn't going to run with the $700 machines. I plan to use this one for data storage and access, not as my main machine. To that end, setting up a simple database and retrieving information, online data searches, e-mail, and blog posting (pictures, text -- running on Wordpress) has so far been a breeze and this E15 is more than fast enough, has plenty of storage, and a very good set of ports including VGA. The CD/DVD drive works perfectly and is a nice addition, as my other relatively new laptop did not include one. Windows 10 is pre-installed as are the usual bloatware, easily uninstalled. Speakers actually sound pretty good, though I'm a headphones guy and would never judge a laptop by its sound system.Battery life is exceptional, making this an ideal travel machine.Two issues. 1) This is not a genuinely dual channel setup. This is 4 GB + 2GB (a kind of 'flex' processing) and while this likely won't matter to many budget customers, as the speed will be plenty fast, I think claiming dual channel is a bit misleading. It is faster than a single channel of 6 GB. OK, I'm being a little picky. 2) The screen isn't the best. It looks a bit dull, frankly, kind of like the old TFT screens found on all those old Toshiba laptops from years ago. If you're trying to save money on a laptop but still need deep, clear, saturated color, I'd recommend looking elsewhere.For the price, this E 15 is a very competitive machine. It's fast enough and has enough storage, ports, a dedicated number pad, and a responsive enough touch pad that I'm finding it very easy to use. (Using two-fingered commands on the pad is especially good on this machine.) Were it to have backlit keys and a better screen, it would be a stellar laptop for all my needs and would likely make it to my office as my main machine. As it is, it's a great backup and would be the perfect student computer as long as graphics aren't terribly important. Heck, it even looks great.This is my first Acer but it likely won't be my last.",2,2,1,3,2
27,"If you have read some other reviews, you may have noticed the gripe about there being 10 gigs left after what it came with. Truth! Plus, it wants to update right away. So if you are buying this for just light use or for the kiddos, do yourself a favor and buy a good sized SD card to add some space because if you want to download anything that is going to use space, you will run out quickly. You're almost better off opting for a computer with more hard drive space if you don't want to mess with that. You can get rid of a few apps, but you aren't going to recover much space. I do feel that that it should be clear that you are only going to have 10 Gigs, in reality since so much of it is taken up by other processes.The update was slow. The computer is slow, so the update took a long time. Like hours. Windows 10? It ran slow too. Basically most functions ran slow. This is the turtle in a race against the rabbits you can buy out there. If you are accustomed to a fast running computer, this is not the model for you. If you just want to do some basic things on it (no gaming for sure), then it's probably OK for your needs.The computer did well with web browsing and played Netflix just fine. The charger is small and light as well and that's also a plus for traveling.But, it was super light --- which made it great for flying with. The battery life was pretty good for flying also.",3,4,5,4,3
28,"Very good, works well, is fast",2,2,1,3,2
29,"Please read the product description. There is absolutely NO memory on the computer. I downloaded google chrome, kindle and one other app and that was all the space available. Speakers were good but that was its only redeemable quality.",3,1,5,4,3
30,These five Acer Flagship CB3-532 HD Chromebooks are working beautifully in my Aquatic Science classroom. They are helping my students do research; post to Schoology; write essays and so much more.,2,2,5,4,2
31,Refurbished laptop works excellently and if you can handle there being a couple of scratches that do not in any way impact the performance of the computer this is the perfect product!,2,2,5,4,3
32,"I absolutely love this product. It is light, and ideal for traveling with. Has a SSD with more than adequate storage for my needs, more than enough RAM, more than enough CPU speed/performance for everything I do. Battery life is ~ 7h. The network connectivity chip of this PC is a welcome change from my last PC (an HP which struggled with connecting to Wifi). This laptop immediately locks in to the nearest WiFi extender in my home - or any other WiFi I connect it to. LOVE the back-lit keyboard (my MUST-HAVE feature). Just the perfect PC for me. Very happy - No hesitation recommending this product.",1,2,3,2,4
33,All the specs are there! Awesome laptop!,2,0,3,2,2
34,nice product and useful for my kids for their activities,2,2,0,2,2
35,"Being new into computer gaming reviews are accurate. Runs smooth, and haven't had any issues with games. Battery life sucks, and the fan gets loud, but with my setup it doesn't hinder anything and if I needed something mobile i'll pick up my Switch. Very good buy for the price!",2,0,1,0,2
36,Great computer from my grandkids.,3,4,5,4,3
37,Worked well right out of the box,2,2,5,4,2
38,No problems,3,4,5,5,6
39,Good laptop but the charging cord is trash. I breaks within 2 months if you do anything except use it as a desktop machine. Dell's warranty is not worth the paper it is printed on and will not be honored. I cannot recommend spending 700 for a laptop then having to spend an additional 40 every 2 months on new charging cords. Any type of frequent movement (ie adjusting how you are sitting while reading in bed on the laptop) causes the power cord to separate from the plug that goes into the computer.UPDATE: The day after posting this review I received a call from a higher up in dell customer service. They upheld the warranty and sent a new cord. When I received the new cord it was obvious that the original cord was defective from the beginning which could happen with any product. Other then the cord issue it is a good reasonably priced gaming laptop.,1,0,1,2,2
40,I love it!,2,4,5,4,3
41,"Disappointed to find that this product was used, box had been open and it had scuff marks on it. Understand that its a good price but it doesnt say anything in the description about the item being a return or used. BUYER BEWARE",1,2,3,2,4
42,Great laptop. Not a single issue. Upgraded wifi card cost $30ish otherwise havent changed a thing.,2,1,1,2,2
43,"Great product, more than I expected.",2,2,1,3,1
44,"I purchased a new Asus UX430UAR. Set up and immediately experienced blurry text in some programs. I contacted ASUS customer support and spent 2 days going back n forth with them. They identified that my computer did not have Splendid, Eye Care, Tru2life Video and Audio Wizard software. Upon installing drivers I received the ""Missing ICM file"" when Splendid was installing. Customer service had me reset my computer back to factory and I still received the error. They recommended that I send it back to seller (Amazon). I received my new laptop and once set up with all current updates, still no Splendid, Eye Care, Tru2life or Audio wizard!! Went through installing all the drivers again, received the same error ""Missing ICM file"". Very frustrated that 2 computers both have the same problem with no fix from ASUS.",3,2,2,0,3
45,"In 2018, GTX 1050 is little not buy-worthy but for this budget, this is the best. Thin and awesome design. Fans are little loud when the gpu at max.Played far cry 5 High quality (not ultra) without a single problem except the fans are louder than expected. That is not a big problem if you use a headphone",2,0,1,0,2
46,"It looks great but i could never finish upgrading the system as soon as I got it. It was the slowest machine I have never had, and my last one was a dell machine I bought on 2008. It took to long to turn on by a 2018 standard. The battery was at 43 percent after fully charged after 1 and 1/5 time of looking it up. Disappointed I returned it right away.",3,2,1,2,2
47,"This computer is advertised as having a ""quad core"" processor which would seem to imply that at a minimum it is not slow. My experience with this machine for a few months now can best be summed up in one word, ""disappointed"". This computer is so slow that when using Microsoft Word, Edge, or Outlook, the screen display cannot even keep up with my slow typing. It lags at least a word behind. Very awkward. In addition it is incapable of going more than one level deep into any web site. If there are pages with photos to look through it simply stops and freezes. It has been OK for the purpose I intended which is reading my Kindle books using your Kindle for PC software, although it often takes more that a minute for the program to open. I would not recommend this computer to anyone who has even average speed requirements.",3,1,5,4,3
48,"Computer arrived new in original packaging, when turned on it had a pink horizontal line all the way across the screen. Had to return. Amazon refunded my money and I ordered another computer.",2,2,1,2,1
49,I've owned Asus computers and mother boards for a long time and they have always met my expectations.Their support is good and the forums are helpful. This P-Series is fast and the screen is sharp.,2,2,1,2,2
50,"Great PC, did everything I needed for school. I had to return it because it did not have the correct version of Windows. It claimed to have windows 10 pro, but in fact had a non-genuine copy of windows enterprise.",3,2,5,4,6
51,"Very pleased with this purchase, I got it mostly for my wife to work on her spreadsheets and scheduling for work remotely that being said it runs silently while doing that and the battery life is pretty good.I myself am a gamer and wanted something to be able to play games when away from my desktop we brought it on a trip and I was surprisingly able to play far cry 5 on ultra settings at 1080p while keeping a stable frame rate of 40 to 55 FPS which for a laptop with an i5 and a 1060 max q was awesome though the only downside is. that you have to keep it plugged in and the fans can be a bit noisy but I play with headphones so it wasnt a bother at all I would recommend this laptop to anyone at this price point.",1,0,5,2,2
52,"Very great affordable gaming laptop. The specs dont lie. For the price of this laptop, its hard to get much more than what this laptop provides, I have yet to run into a game it cant play and its remarkably fast and is also fashionable",1,0,1,2,2
53,"Battery dies fast, but in other aspects this laptop is 10/10!",2,0,1,2,2
54,Excellent !!....,2,2,1,2,2
55,"Update: see the original review belowIt's been a year and I'm finally out of space which is fine because I can buy more storage (ie. Micro SD Card) if you're unsure about buying a mostly cloud based laptop go for it but know that you're not doing for space. I would definitely purchase this again and stand by my five star review.*****I didn't want to review it til I was sure and I'm certain this computer is legit. It's lightweight, affordable, and pretty to look at. I even found a matching wireless mouse. I've had this laptop for a little over a month and I enjoy how fast it is. I use it for word processing mostly and blogging. The fact that you can also add your own storage with a micro SD Card is also a big win. I'm thinking of purchasing an external hard drive for more storage. I haven't run into any cons so far. I can watch videos, write, and not worry about any lag. It's so light that you can carry i t with one hand. The color isn't a shiny gold and I don't care. I would recommend this for anyone that's on the fence about purchasing this.",3,1,5,4,3
56,Great Product,1,2,3,2,4
57,"Really small, which i love. Light weight which is amazing.Its a bit slower than i expected, but its good for what i need it",3,1,5,4,3
58,Could possibly be returning it. I'm sure the product itself is great but it arrived in an extremely damaged and oversized box so the device had clearly been slamming around in there the whole way to my house and I think that directly relates to the fact that at least 5 times per day since I got it(which was less than 7 days ago) it has frozen to the point where not even the power button works and I have to do a hard reboot to get it to work again. Really annoying when I'm in the middle of note taking on it at school. I really don't want to return it but I feel like I have to... I may give it a few more days but I should of said something to amazon as soon as I got it. I ordered it just in time for school though and I don't wanna be stuck without it now that all my class docs are on it...,2,4,5,4,5
59,"Gift for husband, he loves it and may have to buy another one!",2,4,5,4,5
60,"I think this computer is awesome for the money. If you are looking for a Windows computer for under $500, it's hard to beat this one.",2,2,1,2,2
61,"Arrived fast, no damage to packaging. Took a while to get started and complete all the updates but this is perfect for us!",3,1,5,4,3
62,Great computer for the money! I love the keyboard - my fingers fly on it!,3,1,5,4,3
63,Great purchase!,2,2,5,4,2
64,Absolutely love my new laptop. Have always wanted one with a backlit keyboard. This thing is super fast too!,2,2,0,2,1
65,Fast. Works great!!,2,2,1,4,2
66,"I agree that the keyboard could be better. It's not 'bad' or 'awful'. It doesn't have a lot of travel and the keys do feel a bit 'cheap'.However, if you type a lot you'll have no problems at all.The machine is light, very attractive and thin.It's responsive and quick.I cannot speak to battery life as I've not run it flat yet.This machine is replacing an Acer C720 and I'm extremely pleased with it.Obviously with Chromebooks setting up is extremely simple.Running Android apps on the Samsung Chromebook Plus is very good. I realise there are some mixed experiences as some apps don't scale to the screen well. So far that's not been my experience. I guess it depends on the apps you're using.The screen is fantastic and the sound if very good. Given the limitations I'm quite happy with the volume. I don't expect bass on these devices so if you want a stronger bass, buy external speakers that have this capacity - you can't expect miracles.",2,4,5,4,5
67,"I recently purchased the Chromebook Plus and Chromebook Pro. I initially thought I would like the Pro better because it is faster. However, if you use the Stylus much - such as in Squid you will find that the PLUS has noticeably less lag than the Pro. Apparently there is some optimizations that Google has done with the OP1 and Pixel that allow what is called Instant Ink.So if you want instant ink stylus response the Plus is better than the Pro.I have also noticed the Pro seems to run hotter and have a noticeably shorter battery life.I will be sending back my Chromebook Pro and keeping the Chromebook Plus. To me the Plus is fast enough, has better battery life, runs cooler and if you take notes in Squid it is noticeably more responsive.",2,4,5,4,5
68,"The performance and built quality is amazing. The laptop boots up extremely fast and plenty of RAM really helps if you into coding or data science.There's just one issue that many other DELL users have also mentioned. Certain applications like VLC, Codeblocks get pixellated despite the laptop supporting that level of graphics. Maybe there are some display compatibility issues.Overall, this laptop is an extremely good option in this price.",1,0,1,2,2
69,"So, first thing is first: I am not a heavy PC gamer. I play mostly consoles when I do game. But I needed a new laptop for school and music production and it's rare to find a laptop with an actual graphics card higher than a 960M for this price.A few points:This DID come with 8GB DDR4 RAM, a 4GB GTX 1050 (not the Ti edition), and a 1TB hard drive. It does support up to 32GB RAM using 2 16GB sticks, and is upgradeable through a door on the bottom.Pros:-This laptop feels sturdy and solid. I love the red accents and the solid black main body color.-The graphics card has handled the light gaming I've done with it with flying colors. So far, I've tested Portal 2 at maxed out settings and it's done roughly 180-200fps. LA Noire at all maxed settings keeps a steady 30fps (it's frame locked), Metro 2033 at maxed settings runs at roughly 45fps.-The Intel i5 has been a solid CPU for it as well.-The wifi uses ac and b/g/n so it makes full usage of the 5ghz channel for wireless. The speed difference is night and day. I get almost triple the download speed using ac over b/g/n.-Battery life unplugged and surfing the internet is really good. 7-8 hours.Cons:-Ok, so this is my major issue and the only reason it's not getting 5 stars. The speakers are...not great. They advertise a subwoofer, but I'm not sure what the deal with that is since the bass on this is average at best. The speakers do tend to crackle and distort at higher volumes to the point where a musician like myself gets very annoyed. I'm actually debating on buying a bluetooth speaker to use instead.Overall, if you're looking for a solid gaming laptop, this is probably the best one I've found, but be aware that the speakers are not great and I almost feel like they dropped sound quality to increase graphics quality. It's a weird trade.",1,0,1,2,2
70,"Dont get me wrong: this laptop is light years ahead of any computer I have ever owned. It is slim, light, fast, great looking I really wanted one that had an SSD and hard drive so I could work quickly but store a lot of photographs and at work. But for streaming video it is terrible  the sound is very quiet and very muffled. I dont want to have to get external speakers or wear headphones every time I want to watch a show. Havent decided if Im going to return it but Im very disappointed.",1,2,1,2,3
