index,review,cpu,graphicard,hardisk,ram,screen
1240,"<UPDATE>Changing the rating from 3 STARS to 2 STARS due to bad hardware compatibility.I found the cause of the hiccups and inconsistent frame rates as originally stated below. The combination of this Intel Chipset and Nvidia Chipset has reported issues almost like its a bug they can't fix. The 1050 isn't powerful enough to do most of the processing, so the i7 will enter (turbo mode) while your gaming to accommodate the lack of processing power. When this happens, your FPS will drop to a constant 30FPS. Once the switch to turbo is done, your frames will go back to normal. ""Usually took about 30 seconds. and would happen about every minute or so.""HOWEVER: If your game is new enough to where it enters turbo boost and stays in turbo boost - you wont have a problem. So this will only effect older/dated games. or if you have your laptop in performance mode and put the graphics all the way down for highest possible frames""</UPDATE>WARNING: If you are purchasing this laptop for gaming, be prepared to play all your games on the absolute lowest settings. Also, I received a laptop with bad speakers (uploaded video)I purchased this laptop thinking it was going to be an upgrade from my previous computer. Sadly that was not the case.My previous computer:i5-3750k8GB GSkill RAMGeforce 960 GTX4TB WD HDD240fps CSGO (with tweaked config)200fps Rocket League180fps Quake Champions85fps GTA V96fps PUBGRan flawlessly with no hiccupsThis laptop:180fps CSGO (with same config)150fps Rocket League75fps Quake Champions60fps GTA V50fps PUBGLots of hiccups and was very inconsistent and choppy.The i7 is not ideal for gaming, but performs well for multitasking programs.There was a lot of bloatware I had to remove in order to gain any type of performance boost.If you dont know how to turn off windows 10 xbox stream, on battery CPU power management, and nvidia laptop battery saver settings, your games are going to run at a solid 30fps or 60fps no matter what.This laptop is not a good gaming laptop for the price. I've had better gaming performance with a $700 Dell i5 Inspiron Laptop.",2,0,1,0,2
1241,It really has 16gb of ram. Can run Star Wars: The Old Republic on high settings without any problem. Highly recommended and worth its price.,2,1,1,2,2
1242,I bought this laptop for my husbands birthday. He had issues with the update which took FOREVER. He complained about it being extremely slow (please note our WIFI speed is 110 MBPS) hes had to do a hard reboot several times and still is not working properly.Hes not wanting to send it back but we may have to.,2,4,1,2,2
1243,It's a decent laptop,2,2,5,4,2
1244,This laptop worked great for 3 days then it lost connection with the hard drive. Amazon support sent a replacement right away. I hope the replacement doesn't fail.,3,4,5,4,3
1245,"Very light and easy to carry around. Would like to have more choice of colors, but it only offers one color. The cursor is quite sensitive and easy to navigate, comes with a HDMI port so that you can stream videos to big screen HDTV. (needs a micro-HDMI to HDMI converter, not provided with this product). ASUS gestures provides more convenient way to move around the key board. One thing could be improved is that the CAP Lock key provides no indication when it is pressed.",3,1,5,4,3
1246,So far so good,2,4,1,2,1
1247,"everything gone well during importing to Turkey, but laptop itself too loud when u r playing any game... And one ot the direction button (down) was broken! and not working well",1,0,5,2,2
1248,As expected. No issues.,3,2,2,0,3
1249,"Light, good size screen, fast, and reliable!",2,2,1,2,2
1250,It was extremely slow. I have the fastest internet available and all of my devices worked well except for this. It went in and out and on power up sometimes it just sat on a black screen. Sent it back as soon as I could I was so unhappy with this purchase.,2,2,5,4,3
1251,It was a gift and they were very pleased. Wish I would've bought me one also,2,2,1,2,2
1252,"I use this as a portable computer to sketch out ideas in Ableton & Illustrator when i'm not on my Mac. I have noticed some slowness when doing what you think is basic stuff in the OS, but my audio software runs fine. I also popped in a 32gb samsung flash for extra space. not necessary, but super helpful.",3,1,5,4,3
1253,"The ""i"" key does not work.",3,1,5,4,3
1254,DO NOT BUY! I've never dealt with a computer that has so many issues in my life. You have a 30 day return policy and I didn't start using the laptop until after the 30 days was up. I bought this laptop specifically for studying and I can barely even run Word. It constantly crashes and locks up!!!! The only thing I've done on the laptop so far is load Microsoft Office 2016 and it was already causing trouble before I did that.,2,2,1,2,2
1255,"Overall very solid laptop for its price. I've currently loved the computer as it runs smoothly and is very responsive.However, I have had a couple problems small and large. The track pad can be pretty unresponsive sometimes, minor, and the display sometimes totally freezes or black screens for no reason and forces me to restart the computer, major. This second is actually a massive pain in the ass as it can happy anytime and sometimes happen a couple times a day. Still a good computer.",2,0,1,2,2
1256,"I have a couple of problems with this laptop so far. For one thing, the fan comes on very frequently and it runs very loudly. It comes on even while I'm just browsing the internet. In fact, it's blowing quite loudly right now as I write this review. The second issue I'm having with it is that the internet glitches occasionally and it'll freeze up. For instance, while I've been typing this review it froze up but I kept typing and about 7-8 seconds later it caught up with what I had typed...several times now (in less than 5 minutes). It can't be my internet provider, I very rarely had this happen to me on my previous Lenovo laptop.UPDATE: I bumped it up from 2 stars to 3 since I found out how to fix the slow browser issue. If anyone has a similar problem with Chrome on Windows 10, try this: Click the ""Customize and control Google Chrome"" button in the top right; go to ""Settings""; scroll down and select ""Show advanced options""; scroll way down and un-check ""Use hardware acceleration when available"". Haven't had a problem since.",1,0,1,2,2
1257,"Great BUSINESS laptop. The keyboard is far sturdier than the flimsy one in most laptops and the backlighting is not only cool looking but useful. One of the best laptop keyboards ever. Very fast responsive laptop (I use it for business, not gaming) with great storage, great speed and sturdy build. FAR better for the price than comparable laptops from Dell, HP, Toshiba, Acer, ASUS, etc (have used the others).decent battery life - about 4 hours before I get low with heavy use.",1,0,1,2,2
1258,I had some issues when it came out of the box. It isn't updated to the latest windows so it needs to be updated,2,3,1,2,2
1259,"Windows 10 is crap. You would think that Microsoft Windows would work seamlessly with Microsoft Office. Nope. This is my 2nd computer with Windows 10 that I have returned. I use another Microsoft product - Office. Windows 10 will not work with my Microsoft Office 2010 Outlook. I can't connect to my email server. On the positive side, Amazon let me return this with complete understanding about my frustration.",1,0,1,2,2
1260,"I hadn't owned a laptop in more than 10 years. I'm a desktop PC person. One of the most important parts of my job is monitoring the shifts in the land under 50+ year old bridges in the Appalachian Mountains. As we've repaired them, the need for someone to be closer to be able to go physically test the land and check them has increased. I live just within 100 miles of all the bridges I monitor but those close to 100 miles away can't just be checked instantly. I go to a hotel about 10 minutes from a cluster of 6 bridges and stay one day and night per week. Guess who tried to take their desktop PC? Yep. I should say I have other interests and uses for the computer too. I am used to being in a house with my mom, my wife, two kids and two puppies. It's lonely at a distant hotel, so I needed something to play my video games on while monitoring. I didn't do as much studying and researching as I normally would on a purchase like this. I have a fairly good grasp and knowledge of computer parts and what I need and don't need.The screen was important but not a deal-breaker since the hotel is a Courtyard and has HDMI televisions that I could connect to. The screen is very nice and I could only see the most stringent of display snobs having a problem with it. I mean no offense to display snobs. I'm an audiophile, I'm a sound snob, we've all got our obsessions. Speaking of the sound, it's okay, nothing more, nothing less. I have a Bose Soundlink Revolve and take it with me, it connects easily to the laptop's bluetooth.When I bought this there seemed to be some questions about the specs, so I've made a short list of the ones I was most interested in:It has the Nvidia GeForce 1060 6GB video card, it plays everything I play very smoothly. I'll go more into that below.It has bluetooth as mentioned above, and AC WiFi, both work very good.The battery life is good for me but I never have it unplugged for more than an hour to two hours. I guess I could have tested that but I rarely think about unplugging it.The keyboard is so nice that I actually use it instead of plugging a USB keyboard in but I did buy the Logitech smaller wireless keyboard (Logitech MK360) and mouse set just to be safe. Trackpad works well too but I prefer a mouse. Don't hold that against the laptop. I've used a laptop maybe 1 year total in my life and have used a desktop PC for more than 20. I'm just not that used to the trackpad. The keyboard and trackpad are backlit with a red color, it's non-offensive and non-glaring and helps a lot if you like to use it in the dark.It has a Solid State Drive that had around 80 GB of free space upon booting it the first time. It's used for your Windows which gives you a fast bootup. It also has a Hard Disc Drive that has 920 GB of free space upon booting it the first time. It takes less than 10 seconds for me to go from pushing the power button, signing in to being on the desktop. That's very comparable to my high-end desktop PC.There's an HDMI 2.0a, a USB-C Thunderbolt and three more 3.1 USB (those work with the older USB versions, if wondering).It has 8 GB of RAM, it can be upgraded to 32 GB and is very simple to upgrade if you need more RAM.This laptop either met every need I had or surpassed the amount I needed. The video card is a bonus to me. I don't play the newest games and usually prefer console versions. I will say I can play Morrowind with graphics overhaul with no problem on this laptop. I also can play Fallout 4 on it with no problems. And what I've been mainly doing is using it to play games through PS Now, it runs those perfectly. I don't get any of the noise, I'm guessing I'm not pushing the card that hard but will say it's very comparable to my PC at home that has a GeForce 980 GTX in it. And I'm again guessing that's because these games I play aren't very stressful on the GPU. The 980 GTX is rated quite a bit better in benchmark tests but take it from me, unless you're playing the very newest games on ultra settings, you're not going to notice. I spent 3 months buying that PC with the 980 GTX and can say I don't think I've ever come close to using all the power it has.Which makes this a great ""work"" computer! I do use a few programs for work that this laptop handles easily. I'll also mention that there wasn't much bloatware on it. And by the way, Cortana is not disabled when you first setup the laptop so be aware. I plugged it in and turned it on, went to the bathroom, came out and heard someone talking. It was Cortana. I'm also one of the people who really likes Windows 10 and it works well on this laptop.I can't find a single fault with it. Unless I wanted to complain about the sound but what do you expect from a laptop? I would normally say whether it's overpowered for some people or underpowered for others but I think those looking at it are probably like me and thinking about some gaming use. I will upgrade the RAM eventually, probably in summer but it's really not needed yet. All in all, I think for the price, the video card, the good dual hard drive format, it's about as good as you can ask for.Look at that, I forgot to mention it doesn't have a disc/optical drive. I really planned it that way since I didn't even notice it until a few weeks of using it. That might be a downside to some, so make note of that. I have a USB disc drive if I need to use a disc but haven't in at least a year. And guess I should mention that it's well-built, might be a hair heavy for some. My daughter used it one day and said it felt like a triple version of her laptop. Dell did a nice job with this laptop.",1,0,5,2,2
1261,Only used it once so far.,2,2,5,4,2
1262,My husband bought this for me and I absolutely love it. I'm still getting use to having a touchscreen. It's lightweight and perfect size.,2,2,0,2,2
1263,I returned the Chromebook for a full refund because it was used not refurbished it was filthy and it it had numbers ground off of it.,2,2,5,4,3
1264,"Touchpad is defective. Cursor jumps around, clicks on icons. Don't recommend using.",2,1,1,2,2
1265,"I'm in love with it. I wanted a very portable laptop but was afraid of it being too small. With this model, I barely feel that it is an 13"" screen. Its build is pretty solid and has a very affordable price tag since it comes with 16GB ram and intel core i7 8550u. In my country, a laptop with these and other specs cost like 300 to 400 bucks more or less. Is ironic that buying it at amazon and even paying a delivery company internatinal shipping fee, is way cheaper than buying it at home.The tablet option comes pretty handy when using media. I can only complain about storage capacity but I can survive with a portable hard disk and cloud storage services.",3,2,3,2,4
1266,Works fast and the screen are awesome,3,2,1,4,2
1267,Within two weeks my computer begin to shut off by itself. Which put me in a bad position I had just started a master's program which is the reason why I bought the computer. I'm very disappointed.,3,2,2,4,2
1268,Great Chromebook and found it on sale on Amazon for less than $390. Very fast and looks beautiful.,2,4,5,4,5
1269,i love it great little computer for my needs,2,2,5,4,6
1270,Could not be happier.,1,4,1,3,2
1271,This laptop was a great purchase. It has all of the features that we needed for our employee and was very easy to setup. I would highly recommend buying from this company. The employee that received the computer was very happy with the sleekness as well as the speed of the laptop.,2,4,1,2,2
1272,Its an amazing laptop with good price.Very fast with incredible proccessor,2,0,1,2,2
1273,"The computer is really nice, just needs a sd card to help it function better. Before or after purchasing buy a sd card to ensure you are able to add music and pics. The wifi picks up incredibly and Cortana is always there to provide help. I highly recommend purchasing this product",3,2,5,4,6
1274,I wish I would have paid more attention to the reviews. Word of mouth is sometimes the best way to review a product vs. learning the hard way. I've only had this laptop for a few months and we're already considering purchasing another computer. It is slow. And we're already getting warnings about the coolant (fan system) malfunctioning!,3,1,2,4,2
1275,Love this Laptop,1,0,5,2,2
1276,"This is my first Chronebook. It is lightweight, nice screen and really fast. Takes a check with the tutorial on how to access all the programs as they are not installed on the hard drive.but online It is easy to learn and I now prefer it; it got me through my college finals! I recommend this laptop to anyone who is considering buying a reconditioned laptops; it- looks and acts new. Arrived in Box on date specified.",2,2,5,4,3
1277,"This is SOOO not the computer pictured on Amazon. I specifically purchased this one because it had all the features that i needed, plus a number keypad on the right hand side. This one, as you can see pictured does not. I'm not satisfied with my purchase.",3,2,5,4,3
1278,"So far I've been totally enjoying the experience on this laptop. It came with the parts needed to install an additional SSD or HDD which I bought separately and was more cost efficient might I add than buying the laptop with the 1TB HDD preinstalled. This laptop has not overheated and I have ran benchmark tests on this laptop as well as played for 6+ hours straight with games such as Lol, Dota 2, Overwatch, and Battlefront on full settings.Will give updates upon any change that takes place.",2,0,3,2,2
1279,"it's a beautiful laptop very nice , liked how thin it is , but VERT disappointed in the function of the laptop. very slow to many programs that are not needed . and when it updates takes up to much space. very unhappy.",3,4,5,4,3
1280,"Other than backlit keyboard, every other specs are very satisfactory with this price.. Screen is very crisp and CPU speed is very fast. Furthermore, the thickness of PC is also very ergonomic for typing. I am using 3 asus laptop. Overall, Asus laptop give excellent experiences..^^",1,4,1,2,2
1281,"Worked well right out of the box. Had some visible signs of light wear on it, but there was a high quality sticker cover over the top that covered up any sort of irregularities that might've been on the back of the LCD screen. Overall a good product and easy to work with.",2,4,3,2,5
1282,Good performance. Very satisfied with all aspects,1,0,1,2,1
1283,"Dead On Delivery, No quick fix, called Samsung, tried to hard start it, didn't work, sending back! I really liked everything about it, it's a shame it was DOA. Now I wonder if it was a returned item recycled and resold!!!! Not Good!!!",2,4,5,4,5
1284,"I've been a devoted Windows user since the early 90s. In parallel, and in counterpoint, I've also cycled through countless Windows laptops over the years, including Compaq, HP and Dell, and often been disappointed with the longevity of the machines. I nevertheless retained my affinity for the Windows operating system---so much so that when I purchased a MacBook Pro last year, I partitioned the disk and continued operating under Windows 10. I therefore greeted news of the Surface Laptop this spring---with its sleek and unitary design, and integration with other Microsoft products---with great enthusiasm. At last, I thought, the hardware would rise to the level of the software. The Surface Laptop would be Microsoft's answer to Apple.Alas, upon buying the machine (indeed, the highest-end model), I found myself severely disappointed.First of all, it ran noisy and hot right out of the box. Second, I could not even obtain a full-screen display on a standard Samsung external monitor (a defect which could not be resolved through a lengthy call to Microsoft Tech Support). How could Microsoft overlook such a basic requirement?After several hours of struggling I put the machine back in the box and returned it for a full refund. From Microsoft, I expected much better.",1,2,3,2,4
1285,"I have two days with this laptop and it's super slow, at first I thought it was because the programs were running for the ""first"" time but it's all set up and keeps slow, I don't have photos, music or any program installed so I can't imagine if I start installing something. My phone is faster than this laptop. I keep getting ""no response"" using internet explorer and I am just using two tabs with nothing else open. Super slow, no keyboard light. I will return this tomorrow morning.",2,2,1,3,2
1286,"Being a console gamer all my life I finally wanted to try some PC gaming. After researching over 7 laptops for a month I finally found this one. I had to research what graphics cards and cores and processors were. So yea I'm a noob lol. It after owning this for almost a month now I can say it is the best PC I've ever had. It's fast and plays games really well. Have not had any issues. Yes the screen is a TN panel so it's matte instead of glossy, however it's still really good and worth the price. Overall great product and especially if your new to pc gaming like me.",1,0,1,2,2
1287,"It's a great laptop, all good but the only problem i have troubles to activate windows 10. Obviously its great for work office or basic scientific research.",2,2,1,2,2
1288,"I am new to laptop gaming, I mostly play fallout 3, dark souls, and runescape on this laptop. It runs all of them on high or ultra settings very well.",2,0,1,2,2
1289,"The computer would not turn on, sent it back the next day.",3,1,2,4,2
1290,"Easy setup, good quality monitor...Over all ..,.5 THUMBS UP!!",1,1,1,3,1
1291,"Not a bad laptop, had good specs and quality for the price.But mine would not charge as soon as I got it, and a quick google search revealed this has been a serious issue with all Dell laptops for years. There customer support was awful, the emails I got back were in broken English at best. They offered to ""fix"" my laptop but they had to have it for 14 business days which wasn't going to happen since I needed a laptop. They then proceeded to simply stop emailing me back which is when I decided to just return it and pick a different company.It's really a shame since the laptop itself is fine. But this is the second Dell I've owned (both of which have had this problem), and both times I've had equally awful customer support.",1,0,3,2,2
1292,Muy bueno,2,4,5,4,3
1293,"Im loving so it far, i can play the same games my other buddies with there High end PCs can. Al though, im having heating ussies, this is probably a really isolated case since im the only one in the reviews thats having this problem. So yeah, some bad luck for me.",1,0,5,2,2
1294,Awesome product! My only complaint is that the battery doesn't last as long as other Chromebooks I've used. The screen ration is a little out of the ordinary as compared to current laptops and Chromebooks as well.,2,4,5,4,5
1295,"I receive this chromebook on 7/7. it a great portable device that I have been using everyday to browser, school work and watch video on. The problem i have with it is, that the wifi connection speed will drop and if watching video or browsering, the laptop does get warm near the hinge.",2,4,5,4,5
1296,"fast chromebook , i'm really happy , but on this Chromebook you can't install google play!",2,2,5,4,3
1297,"This is a great laptop for its price of $379.99. However it is even greater to buy it or $279.99- which I did at Best Buy on Black Friday of 2017. It's not a gaming laptop but it's a great laptop for its price and it can handle pretty powerful video games but not top most powerful modern (2017 and later) video games.Here are the great things about it for its price:1 TB storage space8 GB Ram memoryGreat graphics card for gaming- which is over 4 GB memory2.7 GHZ processorVery fast computerOther good things about this laptop:-It also has Windows 10 which I like- except for the start menu which I have switched to the Windows 7 version. Everything (in this Windows 10 software) is organized so well-It isn't heavy so it's easier to carry-The screen is bright-The keyboard is comfortable and has the comfortable, convenient and useful Numpad at the right-With its specs it can handle all games that are not too powerfulMy previous laptop cost a bit under $400 that I've bought in 2012 and didn't have all these pros. For $279.99 and even $379.99, but especially the former, this is much better laptop for its price- including adjusted for technological differences in 2012 and 2017.I really don't see any cons... except maybe a slightly weak battery. But I have dealt with it by using power/battery saver mode. On battery at that mode lasts over 3 hours (like nearly 4 hours) which is enough for me.About what kinds of video games it can run:It can't run Ni No Kuni 2 but it can run Naruto Shippuden Ultimate Ninja Storm 3 Full Burst and Tales of Zestiria on minimum specs. Naruto, or both of those games, require 1 GB/1024 MBs Dedicated Video RAM for Recommended run but this computer has only 512 MBs Dedicated Video RAM.",1,4,1,3,2
1298,its not what i expected,2,2,1,2,1
1299,"Buyer beware: this hunk of junk cannot skype. It has a camera, and it is 2016, so logic would suggest that it can, it cant. Chrome just doesn't allow it. I will be selling this at a loss and replacing with a full feature laptop. This should only be purchased for internet browsing.",2,2,5,4,3
1300,So far I love it. I play World of Warcraft and it handles it great. I would totally recommend this laptop to anyone.,1,4,1,3,2
1301,Bought it for my oldest granddaughter and she loves it.,3,1,5,4,3
1302,"So far, one of the most beautiful computing devices I have owned so far. That's a real statement considering I have owned more than 15 laptops in the past decade.The screen is a stunner, touchpad and keyboard are simply fantastic and the sound is surprisingly loud and clear. The ports leave a lot to be desired but isn't a deal breaker. Although I have yet to confirm true daily performance and battery life, so far it has been overwhelmingly positive. I only felt this when I had ordered the Dell XPS ultrathin but was quickly reminded of its deal breaking limitations.You'll want to show this off and will equally enjoy using it as your daily driver. Definitely remember to use the free upgrade to Windows 10 pro until the S version has a store that is well populated with the most critical windows apps for power users and general users alike.",1,2,3,2,4
