index,review,cpu,graphicard,hardisk,ram,screen
570,"The Acer Aspire 1 is at the very most, average. There is nothing special about it. No special features, no amazing screen, everything is just okay. You might be able to justify this at $200 but you could defiantly find a better option for $200 (both used and new). The one thing that is decent is the speakers on the device, they are nice speakers, decent volume, and work fairly well. Saying that, that is probably the best thing I can say about the laptop. This computer seems to be mainly for online use. Even if this is true why not get something like a chrome book which optimizes the chrome browser (my personal day to day browser) much better. Some Chromebook models even have the Google Play Store. Surprisingly the build feels pretty sturdy, its no metal build but it feels pretty solid for $200. If not assumed before, gaming is a definite no for this laptop. Sure, web flash based games will work fine, but anything that requires anything slightly more than this will not work. Many application launchers for games will not even load. If you manage to get a game to load then you will instantly notice the hardware for the laptop. Yes, the hardware is okay for online use but will just not allow you to play any moderately, heavy game. Online use is pretty nice but opening any more than 10 tabs and you will get hit with a low ram message thanks to the very small 4gb of ram. Oh, and don't get me started on the 32gb of storage. Once you first set the computer you will have around 26gb of storage. After installing the new version of windows, downloading 2 or 3 small programs, and downloading 2 windows apps I had less than 5gb of storage. I am not giving this computer such a hard time, just because it cant play any games, but because it is not even good at what it is advertising to do- web browsing. Having all that said, the laptop is not terrible, it is just for a very small audience who need a little laptop to do very little web browsing. I am not part of that audience. You can't bash the laptop too much seeing that it is only $200 but if I were you, I would save my money to buy a more expensive laptop.P.S .. The battery lasts for a very long time on this laptop, but the few nice features are not enough to justify spending $200 on it.Acer Aspire 1, 14"" Full HD, Intel Celeron N3450, 4GB RAM, 32GB Storage, Windows 10 Home, A114-31-C4HH",3,4,5,4,3
571,It's amazing,2,4,5,4,5
572,It has as been just over a week and the Chromebook is still running fast. It was clean when it arrived.,2,2,5,4,2
573,Really easy to set up was skeptical at first because of the price but i absolutely love it definitely recommend it,3,2,5,4,6
574,producto perfecto!!!,3,1,5,4,3
575,"Bought two of these for my teenage daughters for Christmas. They LOVE them! I did purchase an extra 1TB hard drive (also from Amazon of course) for each since they only come with 128GB SSD. They boot up in 10 seconds with the solid state drive which is why I purchased them. I see no reason to pay more for a larger SSD when I can easily add a 1TB drive for $50.I do wish Dell would follow other manufacturers and add a simple compartment on the bottom for upgrading the hard drive and RAM. Instead they cover one screw with the service tag requiring you to pierce it to take the bottom off. I find that to be a horrible business practice. Hey Dell, the 90's are over and people want to upgrade their laptops themselves without paying some overpriced ""service tech"". I guess the threat is that it will void the warranty. Well not in my state.And they wonder why they're losing market share.But even with that terrible corporate Big Brother mentality, it's not worth knocking off a whole star for it.",2,2,4,2,2
576,Purchased five of these for a project here and had to send two of them back to Samsung for failing keyboards after less than a week.,2,4,5,4,5
577,"I like the size and wifi speed and screen image. I knew the memory would be small and it is, but I have portable drives attached for saving files. My need was for something relatively light and fast for emails and sharing documents. It would not be sufficient however if I used it more intensively. I keep many files on dropbox and had to modify the list so that it would save to the device. For the price, it is perfect for me.",3,4,5,4,3
578,Great product,3,4,5,5,6
579,"i like that is light weight, its easy to navigate thru. i think the price was great and i love the color",2,4,5,4,3
580,"Very well designed low budget gaming laptop. I have been using it frequently for the last month or so, and it has worked great! My previous laptop had an issue with overheating on the games I liked to play, but this one handles them well. The GPU is powerful and stays cool, and the laptop is well designed, especially for the price.Cons:- Screen doesn't get very bright (Bright enough, but I'm used to just slightly more)- Cooling fans are pretty loud (Not too big a deal for me, I'd rather it be cool than quiet for gaming)- Battery life is not great but I expected thatPros:- SSD is so nice!- Model I purchased comes with an additional 2.5"" bay as well as a cord to plug in another HDD- GPU runs amazing and stays cool- CPU runs great for games and other programs- Windows touchpad drivers are really good- Installation was so simpleAll in all, I was very happy with this. It works great for what I want, and it came at a killer price for the SSD and GPU inside. There were no major corners cut creating this machine, and I am a very satisfied buyer.Update: Recently I added an HDD in the extra 2.5 bay and it connected without a problem. There was no additional work I had to do other than plugging it in. They even provided the screws!",2,0,3,2,2
581,"A great laptop, especially it has 2TB HD, love it!",2,2,0,2,2
582,"Working perfect! Simple, and good for internet proposing!",3,4,5,4,3
583,Good for the price! I use just for email and internet browsing.,3,1,5,4,3
584,"Works fine. Plays the games I need it to play. Boots fast. Like the lighted keyboard, however, the keyboard is VERY hard to see without the power supply plugged supply because the lighted keyboard only work with the power supply attached. The keys become totally black without the light. There should be a way to use the KB light without the power supply.",2,0,3,2,2
585,This thing is incredibly fast. I have had no issues. I use it primarily to run a DAW (FL Studio 12). It loads my zipped FLP files in seconds and processes everything with ease. I also play Fortnite at medium settings with around 100 FPS.,2,0,1,2,2
586,Great new computer,3,2,0,2,2
587,"Slow useless junk, a complete waste of my money.",2,2,5,4,2
588,this computer is terrible it freezes all the time right out of the box,1,0,1,2,2
589,"Just turned it on and already have only 10 GB left of the 32 GB advertised, this is called false advertising.",3,4,5,4,3
590,"Right out of box it's fast, reliable, temperature stays cool, excellent battery life, does everything I need it to do with blinding speed. The heaviest processor use I do is skype or watching videos online, but it does all of these with ease. Great laptop for the price.",2,2,5,4,3
591,"A beautiful, powerful, and lightweight laptop. I have bought mine in USA and I am just started to use it in my home, Brazil. By the moment it is working like expected, fast and quiet. But, does not have a regular hdmi port and unfortunately none adapter was included in the box, neither for the regular size nor to a vga port (for a such expensive computer and based on my experience with Asus - this is not my first Asus laptop, it was really disappointing). At home I like to use with a mouse and keyboard wireless and connected in a bigger screen (vga connection in my case). Just because of the lack of one or two adaptora, I give it the four stars, otherwise it would certainly five stars.",3,2,2,0,3
592,Poor. Do not buy. Problematic.,3,2,5,4,3
593,"Too many problems, I returned them(2).",2,4,5,6,7
594,"This laptop is absolutely amazing, everything came in perfect. I am always worried about getting a lemon when buying a gaming laptop, and all the reviews out there.After deleting the bloatware, and upgrading all my drivers, this machine is a absolute beast.The price I got mine at was good as well, being that the MSI, and Asus equivalents where a bit more. Me being a solid Asus ROG series man for years I was leary jumping ships but so far I am extremely pleased.The vents, and the extra cool fan you can pop in keep this thing extremely cool.I messed around a little with the overclocking and it got a little warm, but I don't see why you would want to since it runs most tittles with ease.All around I would highly recommend this gaming laptop to anyone.",2,0,1,0,1
595,"I'll be returning this laptop if it runs as soon as it starts up,it's so slow I'm highly pissed. This should have cost 50-60 bucks",2,2,1,4,2
596,"Purchased to up-date older lap-top with Windows XP. It appears that to get Office 16 there will be a monthly/or yearly subscription charge.I have not progressed beyond turning it on for the introduction, then off and back into the box for the present to ""cogitate.""",3,1,2,4,2
597,top split at hinges an now won't receive WI FI signal. loved it when new,2,2,1,3,1
598,"Bought it as a gift for my wife and it is perfect, just what she needed. Great value.",3,4,5,4,3
599,"Great battery, weight, processing speed, and the coolest is the tablet feature! ",3,2,5,4,3
600,"Only had this thing for a couple of weeks, but this is a generally a terrific machine.The good: Good size and weight, beautiful screen, good performance, plus the ability to use as a tablet with a pen. Battery life is also good and the Android support is very useful.The indifferent: The default pen option is Google Keep and the pen is noticeably laggy. However it's fine on something like Squib.The bad. Keyboard is mushy. Speakers aren't particularly loud.But, keyboard apart, highly recommended.",2,4,5,4,5
601,"Purchased the laptop for my children and myself to complete reports, homework, surfing the web, pretty much clerical work. I have purchased a wireless mouse to go with it (because that is something I prefer to use). It doesn't have a lot of memory but it is enough for saving documents just not anything that has to use a lot of memory. Overall glad I purchased.",2,4,5,4,3
602,"I'm a first time Chromebook user. Much better experience than I expected. Fast, intuitive, easy to learn.",2,4,5,4,5
603,"The keyboard build quality and the idea to have speaker on the back is something I don't like. Other than that, everything is great",2,4,5,4,5
604,Equipment received in excellent conditions,2,2,0,2,2
605,"I hate this damn computer. The app store is very limited. If you are a andriod user this is not for you (smartphone). YouTube, Amazon, google drive, google maps, and most other popular apps are not available to you. If Msft would create more apps then it would be ok. Now I am looking to get rid of it. It is worthless.",1,2,3,2,4
606,"My Chromebook suffers from the infamous 'phantom touchscreen issue' (Google/Youtube Samsung Chromebook Phantom touchscreen to know about this issue). The issue appeared after 45 days of purchase and it has made the Chromebook completely unusable. International buyers like me need to be completely aware of this risk when purchasing this product, as this Chromebook model has been launched in just some select markets.",2,4,5,4,5
607,"8/31/2017 . . . I had to reset this HP to to factory settings today. Since this laptop was delivered July 19, 2017, I have encountered more and more slow responses, freezes, and blue screens of death. For Windows 10, it's a much lighter shade of blue than it used to be. Very frustrating. Wasted lots of time dealing with what the HP analysis tools reported as Windows 10 failures and problems with the partitions it created. Equipment checked out according to the HP analysis program, but it has been behaving suspiciously like the hard drive failure on the Dell this one replaced, I' beginning to discover there are no reliable hard drives or virtual drives. They WILL fail. HP seems to have problems accommodating Windows 10, as do ALL anti-virus programs. Nothing good for my computers on which I installed Windows 10.ORIGINAL REVIEW:My observations after 3 days:RUNS COOL! No overheating problems so far.Nice screen resolution with responsive touch screen.Camera seemed grainy, could have been lighting.Keyboard is OK (After all, it is a laptop)Touch pad is weird. Will require retraining your finger/thumb muscles. Although it does have left click and right click buttons, they are UNDERNEATH the touch pad, so at first, you'll occasionally click on the wrong thing. The cursor will move if you don't hit the buttons dead on. Not that bad, just different. I got used to it fairly quickly.Updates didn't take long . . . maybe an hour or two.6 GB RAM is adequate, but seemed odd to me. Why not build evenly? Max 16GB. Holds 2 X 8 GB memory sticks.DDR4 Memory. Description lists DDR4, but additional Information shows DDR3. It really is DDR4..The 2.4 GHz CPU speed is good, especially for a computer under $500.00; it is NOT slow.Haven't put much stress on the processor yet, so can't tell how it will perform in the long run.Used laptop without the charger for about 6 hours (mostly online w/ minimal disk use) before warning appeared that only 20% battery life remained.It runs Windows 10, and to create a recovery drive you must use a USB flash drive. It took up 8.6 GB on a 32 GB USB 2.0 drive. Probably need at least 16 GB drive to be safe. I used USB 2.0 rather than 3.0. It was cheap and took minutes, not hours. (May encounter errors first few attempts, but keep trying. Third time was a charm for me.) I still miss Windows 7 and computers that came with manuals & system CDs.The hard drive storage capacity of 1 TB is probably more than you can use before it eventually fails. The life of a USB drive is not that predictable either, but if only used for the recovery drive and written to only occasionally, it should outlast the hard drive by years.If computer develops problems, I'll revise this review.So far, I have been pleased with this purchase.",2,2,1,3,2
608,"Wife and I were looking for a solid at home laptop that can be used for work if necessary. Saw this was Amazon's Choice and popular laptop. After reading the reviews and recommendations, bought Crucial 8GB Single DDR4 2400 MT/s (PC4-19200) DR x8 Unbuffered SODIMM 260-Pin Memory - CT8G4SFD824A. This is a quick laptop and thankful for all the helpful recommendations.Once the computer was set up, make sure the change over where new files were being saved. Outside of that, fantastic laptop and would recommend to others",1,4,1,2,2
609,"Excellent laptop. Fast, lightweight.",1,4,1,2,2
610,"PC was working fine until latest Windows update caused it to no longer boot properly. I have found that it is missing the standard recovery partition for cases such as this. Dell Support also shows that the warranty expired on April 30, 2018 despite only having purchased this in February 2018. I would not recommend purchasing from this seller.",1,0,1,2,2
611,"Love it so far. I've only had it for about two weeks - but it works well. I'm pleased with the laptop - boots FAST - pretty easy setup. Light weight is nice and I purchased a docking station and hooked it up to my specialty keyboard and mouse. Added a 34"" monitor and all works great so far!",1,2,3,2,4
612,computer crashed after a few days and would not power on,2,2,3,4,3
613,"I traded in my Laptop for credit towards my Samsung Chromebook Plus purchase. I also sold my Android Tablet after having the SCP for a couple days. A must for me, is it runs Android's Apps as well as my Android Tablets/Phones. Since Android Apps are optimized for the ARM processors, the Plus will run Android Apps better than Intel based Chromebooks, it's a trade off as they can handle ChromeOS better, but it is no slouch at ChromeOS. I really enjoy my SCP. I rarely if ever use my Desktop PC any more.IMHO you'll love it. Forget all this talk about people saying the keyboard and trackpad are subpar or lacking. There is a learning curve on the backspace, only because people are used to typing sloppy because it's usually a double sized key. I've compared the keyboard with other Chromebooks and I prefer it. The backlit is more a gimmick but I see its usefulness late night or early morning typing in bed, dark room. But I prefer the battery life. The trackpad is as good as any albeit smaller. The clicks work fine. Palm rejection sometimes fails, but it happens on every trackpad I've used. I particularly love using mine with my Choetech Multiport USB-c hub. Everything, HDMI, USB-C PD pass-through charges and anything I plug into the full size USB just works. Turn off the display or close it, and it switches to ""docked"" mode. Connected to HDMI it will extend the desktop or you can switch to mirror mode. https://www.amazon.com/gp/product/B01MREK4RSAs a 12"" tablet, it works fantastic too! I didn't even mention how useful the pen is for navigating the screen when your fingers are dirty. ",2,4,5,4,5
614,"It sucks, the computer only has 32gbs for me that means that it will not update because it does not have the memory to do so. Why make a computer like that?",3,4,5,4,3
615,"Ive this laptop less than a year and the battery life sucks. After charging, I take it off the charger and I have an hour of use before its dead again.",1,4,1,3,2
616,good great excellent,2,0,3,2,2
617,Works great,3,3,5,5,6
618,"Great choice for my first gaming laptop. Crisp clean resolution and audio and this might be my excitement clouding me but i think my internet even runs faster on it.. Amazing battery life when not gaming (about 6 hours while i was downloading stuff) And while i game with my charger plugged in, even without it the battery life is pleasant. Its fast and powerful for my most played games like PUBG and EFT which are moderatly demanding games. LED lit keyboard makes typing at night effortlessly and the brightness of the computer can be turned down. A great all rounder laptop with more than enough bang for the buck.",1,0,5,2,2
619,"A sweet little computer, perfect for my wife. The only issue, and it had nothing to do with the laptop, was Windows 10 and updating. It took 3.5 hours before I was able to use the laptop. If you get this nice Asus laptop just have a pot of coffee ready, or a drink or two, update and enjoy. My wife, who I have to gently push towards newer technology, is loving it.",3,1,5,4,3
620,It has a very good video card. But it doesn't have dvd rom and vga port. The empty unused space on the left and right of the screen is also not so nice. Touch pad not so smooth.,1,0,5,2,2
621,"For the price i can't complain. I got all the specific things i wanted. I am fairly easy to please and dont need much. However, I just dont like the keyboard...not super easy to type.",2,2,1,2,2
622,"I was disappointed by the quality of the product almost immediately. While I did expect the minor physical defects described and found them to be more minor than anticipated, I did not expect an issue that would impact the use of the product.My particular Chromebook had an issue that caused the cursor to move, disappear, or completely freeze after the screen was adjusted. I suspect a pinched cable in the hinge is the issue.That being said, I enjoyed what little productivity I did get out of the Chromebook; I will return the warehouse ""deal"" for a brand new one and give Samsung the benefit of the doubt.",2,4,5,4,5
623,The color on this computer is not very good and it defies changes to make it more vivid in tones.,3,1,5,4,3
624,"Ilove this laptop. It hass ample ammount of space to download what ever you want and still have room to spare. This machine does great for gaming and does well under heavy loads gaming wise. The software that came with it works well for optimizing games. There are overclocking softwate that came with the machine that works well. I have not experienced any crashes yet either. All in all, 10/10 would recommend to others",1,0,1,2,1
625,"very nice computer for my kid, great for school work and gaming",2,0,1,2,2
626,"I like that laptop didnt even played yet cause i wait nearly 2 hour for now to load after restart. Windows 10 is shit,garbage and trash. I have 2 other laptop with i7 and i5 both windows 10 and both has same problems loading forever. Would be better if laptops would have Windows 7.",2,0,1,2,2
627,After 65 days of normal use. The laptop no longer powers on.,3,1,5,4,3
628,"I particularly like the system because of her affordability but i dislike it because it lacks some feautures which i really need which i was not aware of it before the purchase of it like inbuilt CD drive, and it doesn't come with temporal antivirus. It really sadenned my heart. I dont mind returning for better system and pay more.",2,2,5,4,2
629,"Love this little laptop, and you can't beat it for the price. I purchased it as both a backup machine and to have some portability to work in warmer parts of my house during the winter months.I don't need a lot of bells and whistles on my laptops, and this Chromebook does everything I need it to. I am a writer and work all day on my computer; the keyboard is responsive enough without being oversensitive. I purchased a mouse to go with my Chromebook, but so far, I've just been using the trackpad, which is every bit as good as the one on my old Mac.The battery seems to last forever--I think I'm getting about eight hours out of mine, with multiple tabs open and streaming a few hours of video every day.The profile of the Chromebook is slim, and the machine feels very lightweight, yet it is substantial enough to hold on my lap without necessarily using a laptop desk.The screen's resolution is fine for my purposes, although the text size is smaller than what I've been used to, and I'm feeling a little eye strain. I need to see if I can adjust the settings to enlarge browser fonts. That said, most of my time of the Chromebook so far has been surfing the net; normally, I'd be on Google docs more, where presumably I could enlarge the font as needed. The glare-resistant screen makes it easy to work in front of a window. Also, this feature means I don't have to keep adjusting the screen angle when watching Netflix, for example, and changing my position on the sofa (I don't own a TV, so my computers are my entertainment). Fourteen inches seems to be the perfect size--anything smaller, and I think typing would be a challenge.This is a great machine for writing, Internet research and correspondence, and watching Netflix, Youtube, etc. The fanless model is of course quiet, but it still runs cool. I don't really miss a backlit keyboard (the only feature I wanted but couldn't get on my list of preferences), since I mostly type by touch anyway, and I never work in the complete dark. This is basically like having a faster, more comfortable tablet (ready to go in seconds) without having to install a bunch of apps (I'm fine running most things through my browser). I like the pared-down feeling of the Chromebook.So far, so good, and I'm very happy with the purchase. I've had good luck with HP products in the past, so fingers crossed.",2,2,5,4,3
630,"Paint on top wears off easily,otherwise great chromebook! Dunno why people still buy windows computers.",2,4,5,4,5
631,"I have a very big an powerful desk computer required for my research. But for a personal on-the-road computer mostly for light duty stuff this $999 machine is perfect for me. I hope Microsoft does not destroy it with add-on's, unfortunately their past record suggests otherwise.",0,2,3,2,4
632,"Fast delivery was great, as my daughter was eagerly awaiting for her new chromebook. Product and experience has been great!",2,4,5,4,5
633,"Not my first time buying a surface product and wont be the last. Perfect for a person who primarily needs email, internet, music and media organization. I also do light picture editing from raw format and this handles that very well.",0,2,3,2,4
634,bought by mistake.,2,2,5,4,2
635,"Well I got this laptop to download photos onto from Sd card cause I run a photograpy business on the side , It was hard hard to figure it out the 1st time ,plus It go's black for a few minutes at a time then comes back on , I got it cause it has a battery life of over 10 hours I do session all day long at the park for more the 8 hours the battery life will come in handy but if it continues to go black on me & also tells me it is running out of memory all ready WHAT a joke ,a waste of $ it is not even a month old yet ,I only use it to pay bills & play on FB !! and to download photos onto VERY disapointed I have had acers before & never had this issue & this is a brand new one not refurbished :( i wasted my $ again !!",3,4,5,4,3
636,"This is the worst laptop I've ever bought. For some reason Windows is taking up 28 GB of storage which renders this thing all but useless. I get messages that Windows needs to update but that I dont have sufficient memory for the update. I run disk cleanup, empty the recycle bin etc. and I still don't have enough disk space. I haven't loaded anything big. The largest load I did was for Windows Office. If I open 1 instance of Chrome I will get a message that I've run out of diskspace and the system will have to close Chrome. Chrome suddenly dissapears at that point. I would avoid this Acer model at all cost!",3,4,5,4,3
637,My daughters are enjoying these ..thank you,3,1,5,4,3
